{
  "asset_id": "crate_a",
  "category": "prop",
  "license": "MIT",
  "source": { "origin": "generated" },
  "creator": "studio-foundation bootstrap (tools/blender/make_sample_asset.py)",
  "provenance": {
    "method": "ai_generated",
    "commercial_use_allowed": true,
    "modified": false,
    "ai": {
      "system": "claude-fable-5 via whitelisted Blender script",
      "date": "2026-07-19",
      "prompt_or_workflow_id": "tools/blender/make_sample_asset.py@bootstrap",
      "human_review": "pending"
    }
  },
  "games": "all",
  "lod_policy": "auto",
  "collision_policy": "explicit",
  "texture_policy": "compressed",
  "animation_set": "none",
  "budgets": { "triangles": 2000, "materials": 2, "texture_max_px": 1024 }
}
